{
  "record_id": "garmin-fenix7prosolar-garminconnect-singleexport-strength-001",
  "schema_version": "0.1.0",
  "provenance": {
    "source_type": "singleexport",
    "platform": "garminconnect",
    "export_method": "Garmin Connect activity page — Export File",
    "filename_pattern": "{activity_id}_ACTIVITY.fit",
    "zip_contents": ["{activity_id}_ACTIVITY.fit"],
    "notes": "ZIP contained a single FIT file. Strength training session with a structured workout plan named 'Parry: Light Strength' (40 workout steps). No GPS recorded. No external sensors beyond the watch itself."
  },
  "devices": {
    "primary": {
      "role": "creator",
      "manufacturer": "Garmin",
      "product_name": "Fenix 7 Pro Solar",
      "garmin_product_id": 4375,
      "software_version": "26.04",
      "source_type": "local",
      "device_index": "0",
      "notes": "Creator device. Serial present. device_index 1 (same product_id, device_type=4) is an internal module."
    },
    "sensors": [
      {
        "device_index": 2,
        "device_type": "unknown_module",
        "device_type_raw": 8,
        "notes": "No manufacturer or product info. source_type=5 (local). Device type 8 unidentified. Appears consistently across Fenix 7 Pro Solar files. FitFileViewer does not identify."
      },
      {
        "device_index": 3,
        "device_type": "unknown_module",
        "device_type_raw": 10,
        "software_version": "1.00",
        "notes": "No manufacturer or product info. source_type=5 (local). Device type 10 unidentified. Consistent across Fenix 7 Pro Solar files."
      },
      {
        "device_index": 4,
        "device_type": "unknown_module",
        "device_type_raw": 12,
        "manufacturer": "Garmin",
        "garmin_product_id": 4375,
        "software_version": "35.10",
        "source_type": "local",
        "notes": "Same garmin_product_id as the watch. Different software version (35.10) — likely a firmware component or sensor fusion module. Consistent across Fenix 7 Pro Solar files. No HRM-Dual present — strength session recorded with wrist HR only."
      }
    ]
  },
  "activity": {
    "sport": "strength",
    "sub_sport": "strength_training",
    "display_name": "Strength",
    "num_laps": 0,
    "num_records": 1418,
    "structured_workout": true,
    "notes": "Structured strength workout plan 'Parry: Light Strength'. 40 workout_step messages. 77 set messages (active and rest). 13 exercise_title messages naming the exercises. No lap messages defined. No GPS, no HRM — wrist heart rate only. Duration approx 47 minutes. unknown_312 (split) present with 76 messages; unknown_313 (split_summary) with 3 messages — both present in running and strength but absent from cycling files."
  },
  "message_types": {
    "file_id": { "count": 1 },
    "file_creator": { "count": 1 },
    "device_settings": { "count": 1 },
    "user_profile": { "count": 1 },
    "zones_target": { "count": 1 },
    "sport": { "count": 1 },
    "training_file": { "count": 1, "notes": "References the linked workout plan file." },
    "workout": { "count": 1, "notes": "Workout name: 'Parry: Light Strength'. sport=10 (training), sub_sport=20 (strength_training). num_valid_steps=40." },
    "workout_step": { "count": 40, "notes": "Structured workout steps including exercises (exercise_category + exercise_name), rest periods (duration_type=0), and repeat blocks (duration_type=6)." },
    "exercise_title": { "count": 13, "notes": "Named exercises referenced by workout steps. Names include: Calf Raise, Squat, Hip Raise, and others. Fields: wkt_step_name (string), exercise_category, exercise_name, unknown_3." },
    "set": { "count": 77, "notes": "Strength set records — both active sets (set_type=1, with repetitions and category) and rest sets (set_type=0, no reps). Fields include: duration, start_time, repetitions, weight, category (exercise_category tuple), category_subtype (exercise_name tuple), weight_display_unit, set_type, wkt_step_index, unknown_2, unknown_12, unknown_13, unknown_14." },
    "activity": { "count": 1 },
    "session": { "count": 1 },
    "record": { "count": 1418 },
    "event": { "count": 5 },
    "device_info": { "count": 15, "notes": "5 unique devices × 3 timestamps." },
    "timestamp_correlation": { "count": 1 },
    "unknown_13": { "count": 1, "notes": "training_settings — confirmed via FitFileViewer" },
    "unknown_22": { "count": 1, "notes": "device_used — confirmed via FitFileViewer (undocumented). Count of 1 — no external sensors." },
    "unknown_79": { "count": 1, "notes": "user_metrics — confirmed via FitFileViewer (undocumented)" },
    "unknown_104": { "count": 13, "notes": "device_status — confirmed via FitFileViewer (undocumented). Count 13 matches exercise_title count (13)." },
    "unknown_140": { "count": 1, "notes": "activity_metrics — confirmed via FitFileViewer (undocumented)" },
    "unknown_141": { "count": 1, "notes": "epo_status — confirmed via FitFileViewer (undocumented)" },
    "unknown_147": { "count": 1, "notes": "sensor_settings — confirmed via FitFileViewer (undocumented)" },
    "unknown_216": { "count": 154, "notes": "time_in_zone — confirmed via FitFileViewer (undocumented). 154 occurrences — far higher than other activity types. Likely one per set per zone combination." },
    "unknown_233": { "count": 3883, "notes": "Independent parallel data stream (GPS-independence confirmed by indoor_cycling record). Running alongside record messages at higher frequency. Purpose and encoding unknown." },
    "unknown_288": { "count": 3, "notes": "Count of 3 consistent with prior records." },
    "unknown_312": { "count": 76, "notes": "split — confirmed via FitFileViewer (undocumented). 76 occurrences. Present in running and strength but absent from cycling files. For strength, likely one per set." },
    "unknown_313": { "count": 3, "notes": "split_summary — confirmed via FitFileViewer (undocumented). Present in running and strength, absent from cycling." },
    "unknown_326": { "count": 1, "notes": "gps_event — confirmed via FitFileViewer (undocumented). Minimal occurrence consistent with no-GPS mode." },
    "unknown_327": { "count": 3, "notes": "Count of 3 consistent with prior records." },
    "unknown_394": { "count": 1, "notes": "cpe_status — confirmed via FitFileViewer (undocumented)" }
  },
  "fields": {
    "record": [
      { "def_num": 3,   "name": "heart_rate",    "status": "populated", "registry_status": "sdk",          "notes": "Wrist HR only — no external HRM paired." },
      { "def_num": 5,   "name": "distance",      "status": "populated", "registry_status": "sdk",          "notes": "Populated — watch records distance; likely 0 or near-0 given no GPS." },
      { "def_num": 134, "name": "unknown_134",   "status": "empty",     "registry_status": "undocumented", "notes": "Empty in all observed Fenix 7 Pro Solar files." },
      { "def_num": 135, "name": "unknown_135",   "status": "populated", "registry_status": "undocumented" },
      { "def_num": 136, "name": "unknown_136",   "status": "populated", "registry_status": "garmin_proprietary", "ffv_name": "wrist_heart_rate", "notes": "Wrist HR — only HR source present (no external HRM)." },
      { "def_num": 141, "name": "unknown_141",   "status": "populated", "registry_status": "new",          "notes": "Sample values: 0, 29, 16. Present only in strength record; absent from running and cycling records. Possibly workout step index, rep counter, or a strength-specific sensor reading. Changes every few seconds. FitFileViewer does not identify. Needs further investigation." },
      { "def_num": 143, "name": "unknown_143",   "status": "populated", "registry_status": "garmin_proprietary", "ffv_name": "body_battery", "notes": "Body Battery snapshot at activity start." },
      { "def_num": 253, "name": "timestamp",     "status": "populated", "registry_status": "sdk" }
    ],
    "session": [
      { "def_num": 0,   "name": "event",                          "status": "populated", "registry_status": "sdk" },
      { "def_num": 1,   "name": "event_type",                     "status": "populated", "registry_status": "sdk" },
      { "def_num": 2,   "name": "start_time",                     "status": "populated", "registry_status": "sdk",             "notes": "PII — timestamp not captured." },
      { "def_num": 3,   "name": "start_position_lat",             "status": "empty",     "registry_status": "sdk",             "notes": "Empty — no GPS." },
      { "def_num": 4,   "name": "start_position_long",            "status": "empty",     "registry_status": "sdk" },
      { "def_num": 5,   "name": "sport",                          "status": "populated", "registry_status": "sdk",             "notes": "Value: 10 (training)" },
      { "def_num": 6,   "name": "sub_sport",                      "status": "populated", "registry_status": "sdk",             "notes": "Value: 20 (strength_training)" },
      { "def_num": 7,   "name": "total_elapsed_time",             "status": "populated", "registry_status": "sdk" },
      { "def_num": 8,   "name": "total_timer_time",               "status": "populated", "registry_status": "sdk" },
      { "def_num": 9,   "name": "total_distance",                 "status": "populated", "registry_status": "sdk" },
      { "def_num": 10,  "name": "total_cycles",                   "status": "populated", "registry_status": "sdk",             "notes": "Populated in strength — likely total repetitions across all sets." },
      { "def_num": 11,  "name": "total_calories",                 "status": "populated", "registry_status": "sdk" },
      { "def_num": 16,  "name": "avg_heart_rate",                 "status": "populated", "registry_status": "sdk" },
      { "def_num": 17,  "name": "max_heart_rate",                 "status": "populated", "registry_status": "sdk" },
      { "def_num": 18,  "name": "avg_cadence",                    "status": "empty",     "registry_status": "sdk" },